id,date,time,currency,importance,event,actual,forecast,previous
718,30/10/2021,04:30,USD,medium,CFTC S&P 500 speculative net positions,96.5K,,67.6K
719,30/10/2021,04:30,USD,low,CFTC Silver speculative net positions,37.5K,,30.4K
720,30/10/2021,04:30,USD,low,CFTC Soybeans speculative net positions,43.2K,,43.5K
721,30/10/2021,04:30,USD,low,CFTC Wheat speculative net positions,0.8K,,-8.6K
722,30/10/2021,04:30,AUD,medium,CFTC AUD speculative net positions,-75.2K,,-76.1K
723,30/10/2021,04:30,JPY,medium,CFTC JPY speculative net positions,-107.0K,,-102.7K
724,30/10/2021,04:30,EUR,medium,CFTC EUR speculative net positions,-11.3K,,-12.1K
