id,date,time,currency,importance,event,actual,forecast,previous
356,17/02/2025,09:01,GBP,low,Rightmove House Price Index (MoM)  (Feb),0.5%,,1.7%
357,17/02/2025,09:01,GBP,low,Rightmove House Price Index (YoY)  (Feb),1.4%,,1.8%
358,17/02/2025,13:30,JPY,low,Capacity Utilization (MoM)  (Dec),-0.2%,,-1.9%
359,17/02/2025,13:30,JPY,medium,Industrial Production (MoM)  (Dec),-0.2%,0.3%,-2.2%
360,17/02/2025,13:30,JPY,low,Tertiary Industry Activity Index  (Dec),7.10,0.20,-1.20
361,17/02/2025,19:00,EUR,medium,Eurogroup Meetings,,,
362,17/02/2025,19:00,EUR,medium,Trade Balance  (Dec),15.5B,14.4B,16.0B
363,17/02/2025,23:30,USD,medium,FOMC Member Harker Speaks,,,
364,18/02/2025,00:20,USD,medium,FOMC Member Bowman Speaks,,,
365,18/02/2025,08:00,USD,medium,Fed Waller Speaks,,,
366,18/02/2025,12:30,AUD,high,RBA Interest Rate Decision  (Feb),4.10%,4.10%,4.35%
367,18/02/2025,12:30,AUD,medium,RBA Monetary Policy Statement,,,
368,18/02/2025,12:30,AUD,medium,RBA Rate Statement,,,
369,18/02/2025,16:00,GBP,low,Average Earnings ex Bonus  (Dec),5.9%,5.9%,5.6%
370,18/02/2025,16:00,GBP,medium,Average Earnings Index +Bonus  (Dec),6.0%,5.9%,5.5%
371,18/02/2025,16:00,GBP,medium,Claimant Count Change  (Jan),22.0K,10.0K,-15.1K
372,18/02/2025,16:00,GBP,medium,Employment Change 3M/3M (MoM)  (Dec),107K,,35K
373,18/02/2025,16:00,GBP,medium,Unemployment Rate  (Dec),4.4%,4.5%,4.4%
374,18/02/2025,18:30,GBP,medium,BoE Gov Bailey Speaks,,,
375,18/02/2025,18:30,GBP,medium,Labour Productivity  (Q3),-1.1%,-0.8%,-0.9%
376,18/02/2025,18:30,GBP,medium,Labour Productivity  (Q4),0.7%,,-1.1%
377,18/02/2025,19:00,EUR,low,ECOFIN Meetings,,,
378,18/02/2025,19:00,EUR,medium,Eurogroup Meetings,,,
379,18/02/2025,19:00,EUR,medium,ZEW Economic Sentiment  (Feb),24.2,24.3,18.0
380,18/02/2025,22:30,USD,medium,NY Empire State Manufacturing Index  (Feb),5.70,-1.90,-12.60
381,19/02/2025,00:00,USD,low,NAHB Housing Market Index  (Feb),42,46,47
382,19/02/2025,00:20,USD,medium,FOMC Member Daly Speaks,,,
383,19/02/2025,01:30,USD,low,3-Month Bill Auction,4.225%,,4.225%
384,19/02/2025,01:30,USD,low,6-Month Bill Auction,4.220%,,4.185%
385,19/02/2025,03:00,USD,low,52-Week Bill Auction,4.050%,,4.025%
386,19/02/2025,03:00,USD,medium,Fed Vice Chair for Supervision Barr Speaks,,,
387,19/02/2025,06:00,USD,low,"US Foreign Buying, T-bonds  (Dec)",-49.70B,,-34.40B
388,19/02/2025,06:00,USD,low,Overall Net Capital Flow  (Dec),87.10B,,134.10B
389,19/02/2025,06:00,USD,medium,TIC Net Long-Term Transactions  (Dec),72.0B,149.1B,53.2B
390,19/02/2025,06:00,USD,low,TIC Net Long-Term Transactions including Swaps  (Dec),72.00B,,53.20B
391,19/02/2025,08:00,JPY,low,Reuters Tankan Index  (Feb),3,,2
392,19/02/2025,08:50,JPY,medium,Adjusted Trade Balance,-0.86T,-0.26T,-0.03T
393,19/02/2025,08:50,JPY,low,Core Machinery Orders (YoY)  (Dec),4.3%,6.9%,10.3%
394,19/02/2025,08:50,JPY,low,Core Machinery Orders (MoM)  (Dec),-1.2%,0.4%,3.4%
395,19/02/2025,08:50,JPY,medium,Exports (YoY)  (Jan),7.2%,7.9%,2.8%
396,19/02/2025,08:50,JPY,low,Imports (YoY)  (Jan),16.7%,9.7%,1.7%
397,19/02/2025,08:50,JPY,medium,Trade Balance  (Jan),"-2,758.8B","-2,100.0B",132.5B
398,19/02/2025,09:00,AUD,low,MI Leading Index (MoM)  (Jan),0.1%,,-0.0%
399,19/02/2025,09:30,AUD,low,RBA Chart Pack Release,,,
400,19/02/2025,09:30,AUD,low,Wage Price Index (YoY)  (Q4),3.2%,3.2%,3.6%
401,19/02/2025,09:30,AUD,medium,Wage Price Index (QoQ)  (Q4),0.7%,0.8%,0.9%
402,11/02/2025,All Day,JPY,,Japan - National Day,,,
403,17/02/2025,All Day,USD,,United States - Washington's Birthday,,,
404,19/02/2025,11:00,USD,high,U.S. President Trump Speaks,,,
405,19/02/2025,16:00,GBP,low,Core CPI (YoY)  (Jan),3.7%,3.7%,3.2%
406,19/02/2025,16:00,GBP,low,Core CPI (MoM)  (Jan),-0.4%,-0.5%,0.3%
407,19/02/2025,16:00,GBP,low,Core PPI Output (YoY)  (Jan),1.5%,,1.6%
408,19/02/2025,16:00,GBP,low,Core PPI Output (MoM)  (Jan),0.3%,,0.0%
409,19/02/2025,16:00,GBP,low,Core RPI (YoY)  (Jan),3.2%,,2.9%
410,19/02/2025,16:00,GBP,low,Core RPI (MoM)  (Jan),-0.1%,,0.3%
411,19/02/2025,16:00,GBP,medium,CPI (MoM)  (Jan),-0.1%,-0.3%,0.3%
412,19/02/2025,16:00,GBP,high,CPI (YoY)  (Jan),3.0%,2.8%,2.5%
413,19/02/2025,16:00,GBP,low,"CPI, n.s.a  (Jan)",135.40,,135.60
414,19/02/2025,16:00,GBP,low,PPI Input (YoY)  (Jan),-0.1%,-0.5%,-1.3%
415,19/02/2025,16:00,GBP,medium,PPI Input (MoM)  (Jan),0.8%,0.7%,0.2%
416,19/02/2025,16:00,GBP,low,PPI Output (YoY)  (Jan),0.3%,0.1%,-0.1%
417,19/02/2025,16:00,GBP,low,PPI Output (MoM)  (Jan),0.5%,0.2%,-0.2%
418,19/02/2025,16:00,GBP,low,RPI (MoM)  (Jan),-0.1%,-0.1%,0.3%
419,19/02/2025,16:00,GBP,low,RPI (YoY)  (Jan),3.6%,3.7%,3.5%
420,19/02/2025,17:00,EUR,medium,European Central Bank Non-monetary Policy Meeting,,,
421,19/02/2025,18:00,EUR,low,Current Account  (Dec),38.4B,30.2B,25.0B
422,19/02/2025,18:00,EUR,low,Current Account n.s.a.  (Dec),50.5B,,32.7B
423,19/02/2025,18:30,GBP,low,House Price Index (YoY),4.6%,3.2%,3.3%
424,19/02/2025,19:20,GBP,low,4-Year Treasury Gilt Auction,4.294%,,4.384%
425,19/02/2025,21:00,USD,low,MBA 30-Year Mortgage Rate,6.93%,,6.95%
426,19/02/2025,21:00,USD,low,MBA Mortgage Applications (WoW),-6.6%,,2.3%
427,19/02/2025,21:00,USD,low,MBA Purchase Index,144.0,,153.1
428,19/02/2025,21:00,USD,low,Mortgage Market Index,214.9,,230.0
429,19/02/2025,21:00,USD,low,Mortgage Refinance Index,593.6,,640.6
430,19/02/2025,22:30,USD,medium,Building Permits  (Jan),1.483M,1.460M,1.482M
431,19/02/2025,22:30,USD,low,Building Permits (MoM)  (Jan),0.1%,,-0.7%
432,19/02/2025,22:30,USD,medium,Housing Starts (MoM)  (Jan),-9.8%,,16.1%
433,19/02/2025,22:30,USD,medium,Housing Starts  (Jan),1.366M,1.390M,1.515M
434,19/02/2025,22:55,USD,low,Redbook (YoY),6.3%,,5.3%
435,20/02/2025,00:30,USD,medium,Atlanta Fed GDPNow  (Q1),2.3%,2.3%,2.3%
436,20/02/2025,03:00,USD,medium,20-Year Bond Auction,4.830%,,4.900%
437,20/02/2025,04:00,USD,high,FOMC Meeting Minutes,,,
438,20/02/2025,06:30,USD,medium,API Weekly Crude Oil Stock,3.339M,2.200M,9.043M
439,20/02/2025,07:00,USD,low,Fed Governor Jefferson Speaks,,,
440,20/02/2025,08:50,JPY,low,Foreign Bonds Buying,241.0B,,"1,755.6B"
441,20/02/2025,08:50,JPY,low,Foreign Investments in Japanese Stocks,-352.8B,,-384.4B
442,20/02/2025,09:30,AUD,medium,Employment Change  (Jan),44.0K,19.4K,60.0K
443,20/02/2025,09:30,AUD,medium,Full Employment Change  (Jan),54.1K,,-23.7K
444,20/02/2025,09:30,AUD,low,Participation Rate  (Jan),67.3%,67.1%,67.2%
445,20/02/2025,09:30,AUD,low,Reserve Assets Total  (Jan),103.2B,,102.1B
446,20/02/2025,09:30,AUD,medium,Unemployment Rate  (Jan),4.1%,4.1%,4.0%
447,20/02/2025,19:00,EUR,low,Construction Output (MoM)  (Dec),0.00%,,0.58%
448,20/02/2025,20:00,GBP,low,CBI Industrial Trends Orders  (Feb),-28,-30,-34
449,20/02/2025,22:30,USD,medium,Continuing Jobless Claims,"1,869K","1,870K","1,845K"
450,20/02/2025,22:30,USD,high,Initial Jobless Claims,219K,215K,214K
451,20/02/2025,22:30,USD,low,Jobless Claims 4-Week Avg.,215.25K,,216.25K
452,20/02/2025,22:30,USD,high,Philadelphia Fed Manufacturing Index  (Feb),18.1,19.4,44.3
453,20/02/2025,22:30,USD,low,Philly Fed Business Conditions  (Feb),27.8,,46.3
454,20/02/2025,22:30,USD,low,Philly Fed CAPEX Index  (Feb),14.00,,39.00
455,20/02/2025,22:30,USD,medium,Philly Fed Employment  (Feb),5.3,,11.9
456,20/02/2025,22:30,USD,low,Philly Fed New Orders  (Feb),21.9,,42.9
457,20/02/2025,22:30,USD,low,Philly Fed Prices Paid  (Feb),40.50,,31.90
458,20/02/2025,23:35,USD,low,Fed Goolsbee Speaks,,,
459,21/02/2025,00:00,USD,medium,US Leading Index (MoM)  (Jan),-0.3%,-0.1%,0.1%
460,21/02/2025,00:00,EUR,low,Consumer Confidence  (Feb),-13.6,,-14.2
461,21/02/2025,00:30,USD,low,Natural Gas Storage,-196B,-191B,-100B
462,21/02/2025,01:30,USD,low,4-Week Bill Auction,4.245%,,4.250%
463,21/02/2025,01:30,USD,low,8-Week Bill Auction,4.235%,,4.240%
464,21/02/2025,02:00,USD,high,Crude Oil Inventories,4.633M,3.200M,4.070M
465,21/02/2025,02:00,USD,low,EIA Refinery Crude Runs  (WoW),-0.015M,,0.082M
466,21/02/2025,02:00,USD,low,Crude Oil Imports,-0.961M,,-0.184M
467,21/02/2025,02:00,USD,medium,Cushing Crude Oil Inventories,1.472M,,0.872M
468,21/02/2025,02:00,USD,low,Distillate Fuel Production,0.180M,,-0.009M
469,21/02/2025,02:00,USD,low,EIA Weekly Distillates Stocks,-2.051M,-1.200M,0.135M
470,21/02/2025,02:00,USD,low,Gasoline Production,-0.156M,,0.180M
471,21/02/2025,02:00,USD,low,Heating Oil Stockpiles,-0.343M,,0.159M
472,21/02/2025,02:00,USD,low,EIA Weekly Refinery Utilization Rates (WoW),-0.1%,,0.5%
473,21/02/2025,02:00,USD,low,Gasoline Inventories,-0.151M,0.700M,-3.035M
474,21/02/2025,03:00,USD,medium,30-Year TIPS Auction,2.403%,,2.055%
475,21/02/2025,04:30,USD,low,Fed Governor Jefferson Speaks,,,
476,21/02/2025,04:30,USD,medium,Fed Vice Chair for Supervision Barr Speaks,,,
477,21/02/2025,06:30,USD,medium,Fed's Balance Sheet,"6,782B",,"6,814B"
478,21/02/2025,06:30,USD,low,Reserve Balances with Federal Reserve Banks,3.276T,,3.255T
479,21/02/2025,07:00,USD,low,FOMC Member Kugler Speaks,,,
480,21/02/2025,07:30,AUD,low,RBA Gov Bullock Speaks,,,
481,21/02/2025,08:30,JPY,low,"CPI, n.s.a (MoM)  (Jan)",0.5%,,0.6%
482,21/02/2025,08:30,JPY,medium,National Core CPI (YoY)  (Jan),3.2%,3.1%,3.0%
483,21/02/2025,08:30,JPY,medium,National CPI (MoM)  (Jan),0.5%,,0.6%
484,21/02/2025,08:30,JPY,low,National CPI (YoY)  (Jan),4.0%,,3.6%
485,21/02/2025,09:01,GBP,low,GfK Consumer Confidence  (Feb),-20,-22,-22
486,21/02/2025,16:00,GBP,medium,Core Retail Sales (YoY)  (Jan),1.2%,0.5%,2.1%
487,21/02/2025,16:00,GBP,medium,Core Retail Sales (MoM)  (Jan),2.1%,0.9%,-0.9%
488,21/02/2025,16:00,GBP,low,Public Sector Net Borrowing  (Jan),-15.44B,-20.10B,18.12B
489,21/02/2025,16:00,GBP,low,Public Sector Net Cash Requirement  (Jan),-22.484B,,20.154B
490,21/02/2025,16:00,GBP,medium,Retail Sales (YoY)  (Jan),1.0%,0.6%,2.8%
491,21/02/2025,16:00,GBP,medium,Retail Sales (MoM)  (Jan),1.7%,0.4%,-0.6%
492,21/02/2025,23:30,EUR,medium,ECB's Lane Speaks,,,
493,22/02/2025,00:00,USD,high,Existing Home Sales  (Jan),4.08M,4.13M,4.29M
494,22/02/2025,00:00,USD,medium,Existing Home Sales (MoM)  (Jan),-4.9%,,2.9%
495,22/02/2025,00:00,USD,medium,Michigan 1-Year Inflation Expectations  (Feb),4.3%,4.3%,3.3%
496,22/02/2025,00:00,USD,medium,Michigan 5-Year Inflation Expectations  (Feb),3.5%,3.3%,3.2%
497,22/02/2025,00:00,USD,medium,Michigan Consumer Expectations  (Feb),64.0,67.3,69.3
498,22/02/2025,00:00,USD,medium,Michigan Consumer Sentiment  (Feb),64.7,67.8,71.1
499,22/02/2025,00:00,USD,low,Michigan Current Conditions  (Feb),65.7,68.7,74.0
500,22/02/2025,01:30,USD,low,Fed Governor Jefferson Speaks,,,
501,22/02/2025,03:00,USD,medium,U.S. Baker Hughes Oil Rig Count,487,,481
502,22/02/2025,03:00,USD,medium,U.S. Baker Hughes Total Rig Count,592,,588
503,22/02/2025,05:30,GBP,medium,CFTC GBP speculative net positions,-0.6K,,-3.2K
504,22/02/2025,05:30,USD,low,CFTC Aluminium speculative net positions,2.8K,,3.2K
505,22/02/2025,05:30,USD,low,CFTC Copper speculative net positions,22.1K,,20.9K
506,22/02/2025,05:30,USD,low,CFTC Corn speculative net positions,468.7K,,424.8K
507,22/02/2025,05:30,USD,medium,CFTC Crude Oil speculative net positions,197.6K,,220.0K
508,22/02/2025,05:30,USD,medium,CFTC Gold speculative net positions,268.7K,,284.5K
509,22/02/2025,05:30,USD,medium,CFTC Nasdaq 100 speculative net positions,9.8K,,13.4K
510,22/02/2025,05:30,USD,low,CFTC Natural Gas speculative net positions,-94.6K,,-80.5K
511,22/02/2025,05:30,USD,medium,CFTC S&P 500 speculative net positions,-40.0K,,-17.1K
512,22/02/2025,05:30,USD,low,CFTC Silver speculative net positions,54.5K,,49.7K
513,22/02/2025,05:30,USD,low,CFTC Soybeans speculative net positions,-5.6K,,6.8K
514,22/02/2025,05:30,USD,low,CFTC Wheat speculative net positions,-36.8K,,-55.9K
515,22/02/2025,05:30,AUD,medium,CFTC AUD speculative net positions,-56.7K,,-65.6K
516,22/02/2025,05:30,JPY,medium,CFTC JPY speculative net positions,60.6K,,54.6K
517,22/02/2025,05:30,EUR,medium,CFTC EUR speculative net positions,-51.4K,,-64.4K
518,24/02/2025,All Day,JPY,,Japan - Emperor's Birthday,,,
519,24/02/2025,19:00,EUR,low,Core CPI (MoM)  (Jan),-0.9%,-1.0%,0.5%
520,24/02/2025,19:00,EUR,medium,Core CPI (YoY)  (Jan),2.7%,2.7%,2.7%
521,24/02/2025,19:00,EUR,high,CPI (YoY)  (Jan),2.5%,2.5%,2.4%
522,24/02/2025,19:00,EUR,medium,CPI (MoM)  (Jan),-0.3%,-0.3%,0.4%
523,24/02/2025,19:00,EUR,low,CPI ex Tobacco (MoM)  (Jan),-0.3%,,0.4%
524,24/02/2025,19:00,EUR,low,CPI ex Tobacco (YoY)  (Jan),2.4%,,2.3%
525,24/02/2025,19:00,EUR,low,"CPI, n.s.a  (Jan)",126.72,126.71,127.07
526,24/02/2025,19:00,EUR,low,HICP ex Energy & Food (YoY)  (Jan),2.7%,2.7%,2.7%
527,24/02/2025,19:00,EUR,low,HICP ex Energy and Food (MoM)  (Jan),-0.7%,-0.7%,0.3%
528,24/02/2025,22:15,GBP,medium,MPC Member Ramsden Speaks,,,
529,24/02/2025,22:30,USD,low,Chicago Fed National Activity  (Jan),-0.03,,0.18
530,25/02/2025,00:30,USD,low,Dallas Fed Mfg Business Index  (Feb),-8.3,,14.1
531,25/02/2025,01:30,USD,low,3-Month Bill Auction,4.195%,,4.225%
532,25/02/2025,01:30,USD,low,6-Month Bill Auction,4.180%,,4.220%
533,25/02/2025,03:00,GBP,low,BoE MPC Member Dhingra Speaks,,,
534,25/02/2025,03:00,USD,medium,2-Year Note Auction,4.169%,,4.211%
535,25/02/2025,08:50,JPY,low,Corporate Services Price Index (CSPI) (YoY),3.1%,2.9%,3.0%
536,25/02/2025,11:45,AUD,low,RBA Assistant Governor Jones Speaks,,,
537,25/02/2025,14:00,GBP,low,Car Registration (MoM)  (Jan),-1.0%,,-8.3%
538,25/02/2025,14:00,GBP,low,Car Registration (YoY)  (Jan),-2.5%,,-0.2%
539,25/02/2025,18:15,USD,low,Fed Logan Speaks,,,
540,25/02/2025,20:00,GBP,low,CBI Distributive Trades Survey  (Feb),-23,-21,-24
541,25/02/2025,22:00,EUR,medium,ECB's Schnabel Speaks,,,
542,25/02/2025,22:55,USD,low,Redbook (YoY),6.2%,,6.3%
543,25/02/2025,23:00,GBP,medium,BoE MPC Member Pill Speaks,,,
544,25/02/2025,23:00,USD,low,House Price Index (MoM)  (Dec),0.4%,0.2%,0.4%
545,25/02/2025,23:00,USD,low,House Price Index (YoY)  (Dec),4.7%,,4.5%
546,25/02/2025,23:00,USD,low,House Price Index  (Dec),436.1,,434.3
547,25/02/2025,23:00,USD,low,S&P/CS HPI Composite - 20 s.a. (MoM)  (Dec),0.5%,,0.4%
548,25/02/2025,23:00,USD,medium,S&P/CS HPI Composite - 20 n.s.a. (MoM)  (Dec),-0.1%,,-0.1%
549,25/02/2025,23:00,USD,medium,S&P/CS HPI Composite - 20 n.s.a. (YoY)  (Dec),4.5%,4.4%,4.3%
550,26/02/2025,00:00,USD,high,CB Consumer Confidence  (Feb),98.3,102.7,105.3
551,26/02/2025,00:00,USD,low,Richmond Manufacturing Index  (Feb),6,-3,-4
552,26/02/2025,00:00,USD,low,Richmond Manufacturing Shipments  (Feb),12,,-9
553,26/02/2025,00:00,USD,low,Richmond Services Index  (Feb),11,,4
554,26/02/2025,00:30,USD,low,Dallas Fed Services Revenues  (Feb),8.2,,5.7
555,26/02/2025,00:30,USD,low,Texas Services Sector Outlook  (Feb),4.6,,7.4
556,26/02/2025,01:45,USD,medium,Fed Vice Chair for Supervision Barr Speaks,,,
557,26/02/2025,03:00,USD,medium,5-Year Note Auction,4.123%,,4.330%
558,26/02/2025,03:00,USD,low,FOMC Member Barkin Speaks,,,
559,26/02/2025,03:00,USD,low,M2 Money Supply (MoM)  (Jan),21.56T,,21.53T
560,26/02/2025,06:30,USD,medium,API Weekly Crude Oil Stock,-0.640M,2.300M,3.339M
561,26/02/2025,09:30,AUD,medium,Construction Work Done (QoQ)  (Q4),0.5%,1.0%,2.0%
562,26/02/2025,09:30,AUD,low,Monthly CPI Indicator (YoY)  (Jan),2.50%,2.60%,2.50%
563,26/02/2025,14:00,JPY,medium,BoJ Core CPI (YoY),2.2%,2.0%,1.9%
564,26/02/2025,14:00,JPY,low,Coincident Indicator (MoM)  (Dec),1.0%,1.4%,-1.4%
565,26/02/2025,14:00,JPY,low,Leading Index (MoM)  (Dec),0.5%,1.1%,-1.6%
566,26/02/2025,14:00,JPY,low,Leading Index  (Dec),108.3,108.9,107.5
567,26/02/2025,21:00,USD,low,MBA 30-Year Mortgage Rate,6.88%,,6.93%
568,26/02/2025,21:00,USD,low,MBA Mortgage Applications (WoW),-1.2%,,-6.6%
569,26/02/2025,21:00,USD,low,MBA Purchase Index,144.3,,144.0
570,26/02/2025,21:00,USD,low,Mortgage Market Index,212.3,,214.9
571,26/02/2025,21:00,USD,low,Mortgage Refinance Index,572.5,,593.6
572,26/02/2025,22:00,USD,low,Building Permits (MoM)  (Jan),-0.6%,0.1%,-0.7%
573,26/02/2025,22:00,USD,medium,Building Permits  (Jan),1.473M,1.483M,1.482M
574,26/02/2025,22:30,USD,low,FOMC Member Barkin Speaks,,,
575,27/02/2025,00:00,USD,high,Crude Oil Inventories,-2.332M,2.500M,4.633M
576,27/02/2025,00:00,USD,low,EIA Refinery Crude Runs  (WoW),0.317M,,-0.015M
577,27/02/2025,00:00,USD,low,Crude Oil Imports,0.292M,,-0.961M
578,27/02/2025,00:00,USD,medium,Cushing Crude Oil Inventories,1.282M,,1.472M
579,27/02/2025,00:00,USD,low,Distillate Fuel Production,0.439M,,0.180M
580,27/02/2025,00:00,USD,low,EIA Weekly Distillates Stocks,3.908M,0.030M,-2.051M
581,27/02/2025,00:00,USD,low,Gasoline Production,-0.020M,,-0.156M
582,27/02/2025,00:00,USD,low,Heating Oil Stockpiles,0.134M,,-0.343M
583,27/02/2025,00:00,USD,low,EIA Weekly Refinery Utilization Rates (WoW),1.6%,,-0.1%
584,27/02/2025,00:00,USD,low,Gasoline Inventories,0.369M,-0.950M,-0.151M
585,27/02/2025,00:00,USD,medium,New Home Sales (MoM)  (Jan),-10.5%,,8.1%
586,27/02/2025,00:00,USD,high,New Home Sales  (Jan),657K,679K,734K
587,27/02/2025,01:30,GBP,low,BoE MPC Member Dhingra Speaks,,,
588,27/02/2025,02:00,USD,medium,FOMC Member Bostic Speaks,,,
589,27/02/2025,03:00,USD,medium,7-Year Note Auction,4.194%,,4.457%
590,27/02/2025,09:30,AUD,low,Building Capital Expenditure (MoM)  (Q4),0.2%,,1.1%
591,27/02/2025,09:30,AUD,low,Plant/Machinery Capital Expenditure (QoQ)  (Q4),-0.8%,,1.3%
592,27/02/2025,09:30,AUD,medium,Private New Capital Expenditure (QoQ)  (Q4),-0.2%,0.6%,1.6%
593,27/02/2025,12:35,JPY,low,2-Year JGB Auction,0.826%,,0.727%
594,27/02/2025,18:00,EUR,low,M3 Money Supply (YoY)  (Jan),3.6%,3.8%,3.5%
595,27/02/2025,18:00,EUR,low,M3 Money Supply  (Jan),"16,754.9B",,"16,726.4B"
596,27/02/2025,18:00,EUR,low,Loans to Non Financial Corporations  (Jan),2.0%,,1.5%
597,27/02/2025,18:00,EUR,low,Private Sector Loans (YoY)  (Jan),1.3%,1.2%,1.1%
598,27/02/2025,19:00,GBP,low,15-Year Treasury Gilt Auction,4.836%,,4.558%
599,27/02/2025,19:00,EUR,low,Business and Consumer Survey  (Feb),96.3,96.0,95.3
600,27/02/2025,19:00,EUR,low,Business Climate  (Feb),-0.74,,-0.92
601,27/02/2025,19:00,EUR,low,Consumer Confidence  (Feb),-13.6,-13.6,-14.2
602,27/02/2025,19:00,EUR,low,Consumer Inflation Expectation  (Feb),21.1,,20.2
603,27/02/2025,19:00,EUR,low,Selling Price Expectations  (Feb),9.8,,8.8
604,27/02/2025,19:00,EUR,low,Services Sentiment  (Feb),6.2,6.8,6.7
605,11/02/2025,All Day,JPY,,Japan - National Day,,,
606,17/02/2025,All Day,USD,,United States - Washington's Birthday,,,
607,24/02/2025,All Day,JPY,,Japan - Emperor's Birthday,,,
608,27/02/2025,19:00,EUR,low,Industrial Sentiment  (Feb),-11.4,-12.0,-12.7
609,27/02/2025,21:30,EUR,medium,ECB Publishes Account of Monetary Policy Meeting,,,
610,27/02/2025,22:00,USD,low,FOMC Member Barkin Speaks,,,
611,27/02/2025,22:30,USD,medium,Continuing Jobless Claims,"1,862K","1,870K","1,867K"
612,27/02/2025,22:30,USD,medium,Core Durable Goods Orders (MoM)  (Jan),0.0%,0.2%,0.1%
613,27/02/2025,22:30,USD,medium,Core PCE Prices  (Q4),2.70%,2.50%,2.20%
614,27/02/2025,22:30,USD,high,Durable Goods Orders (MoM)  (Jan),3.1%,2.0%,-1.8%
615,27/02/2025,22:30,USD,low,Durables Excluding Defense (MoM)  (Jan),3.5%,,-1.8%
616,27/02/2025,22:30,USD,low,Durables Excluding Transport (MoM)  (Jan),0.0%,0.3%,0.1%
617,27/02/2025,22:30,USD,high,GDP (QoQ)  (Q4),2.3%,2.3%,3.1%
618,27/02/2025,22:30,USD,medium,GDP Price Index (QoQ)  (Q4),2.4%,2.2%,1.9%
619,27/02/2025,22:30,USD,low,GDP Sales  (Q4),3.2%,3.2%,3.3%
620,27/02/2025,22:30,USD,low,Goods Orders Non Defense Ex Air (MoM)  (Jan),0.8%,0.3%,0.2%
621,27/02/2025,22:30,USD,high,Initial Jobless Claims,242K,222K,220K
622,27/02/2025,22:30,USD,low,Jobless Claims 4-Week Avg.,224.00K,,215.50K
623,27/02/2025,22:30,USD,low,PCE Prices  (Q4),2.4%,2.3%,1.5%
624,27/02/2025,22:30,USD,low,Real Consumer Spending  (Q4),4.2%,4.2%,3.7%
625,27/02/2025,23:15,USD,low,Fed Schmid Speaks,,,
626,28/02/2025,00:00,USD,medium,Fed Vice Chair for Supervision Barr Speaks,,,
627,28/02/2025,00:00,USD,medium,Pending Home Sales (MoM)  (Jan),-4.6%,-0.9%,-4.1%
628,28/02/2025,00:00,USD,low,Pending Home Sales Index  (Jan),70.6,,74.0
629,28/02/2025,00:30,USD,low,Natural Gas Storage,-261B,-276B,-196B
630,28/02/2025,01:00,USD,low,KC Fed Composite Index  (Feb),-5,,-5
631,28/02/2025,01:00,USD,low,KC Fed Manufacturing Index  (Feb),-13,,-9
632,28/02/2025,01:30,USD,low,4-Week Bill Auction,4.235%,,4.245%
633,28/02/2025,01:30,USD,low,8-Week Bill Auction,4.235%,,4.235%
634,28/02/2025,01:45,USD,medium,FOMC Member Bowman Speaks,,,
635,28/02/2025,05:15,USD,medium,FOMC Member Harker Speaks,,,
636,28/02/2025,06:30,USD,medium,Fed's Balance Sheet,"6,766B",,"6,782B"
637,28/02/2025,06:30,USD,low,Reserve Balances with Federal Reserve Banks,3.380T,,3.276T
638,28/02/2025,08:30,JPY,low,CPI Tokyo Ex Food & Energy (YoY)  (Feb),0.9%,,1.0%
639,28/02/2025,08:30,JPY,medium,Tokyo Core CPI (YoY)  (Feb),2.2%,2.3%,2.5%
640,28/02/2025,08:30,JPY,low,Tokyo CPI (YoY)  (Feb),2.9%,,3.4%
641,28/02/2025,08:30,JPY,low,CPI Tokyo Ex Food and Energy (MoM)  (Feb),0.2%,,-0.2%
642,28/02/2025,08:50,JPY,low,Foreign Bonds Buying,-200.8B,,239.6B
643,28/02/2025,08:50,JPY,low,Foreign Investments in Japanese Stocks,"-1,038.0B",,-351.9B
644,28/02/2025,08:50,JPY,medium,Industrial Production (MoM)  (Jan),-1.1%,-1.0%,-0.2%
645,28/02/2025,08:50,JPY,low,Industrial Production forecast 1m ahead (MoM)  (Feb),5.0%,,1.0%
646,28/02/2025,08:50,JPY,low,Industrial Production forecast 2m ahead (MoM)  (Mar),-2.0%,,1.2%
647,28/02/2025,08:50,JPY,low,Large Retailers' Sales (MoM)  (Jan),0.5%,,-0.8%
648,28/02/2025,08:50,JPY,low,Large Scale Retail Sales YoY (YoY)  (Jan),4.0%,,3.0%
649,28/02/2025,08:50,JPY,low,Retail Sales (YoY)  (Jan),3.9%,3.9%,3.5%
650,28/02/2025,09:30,AUD,low,Housing Credit  (Jan),0.4%,,0.5%
651,28/02/2025,09:30,AUD,low,Private Sector Credit (MoM)  (Jan),0.5%,0.5%,0.6%
652,28/02/2025,12:15,USD,low,Fed Goolsbee Speaks,,,
653,28/02/2025,14:00,JPY,low,Construction Orders (YoY)  (Jan),12.2%,,8.1%
654,28/02/2025,14:00,JPY,low,Housing Starts (YoY)  (Jan),-4.6%,-2.6%,-2.5%
655,28/02/2025,16:00,GBP,medium,MPC Member Ramsden Speaks,,,
656,28/02/2025,16:00,GBP,medium,Nationwide HPI (MoM)  (Feb),0.4%,0.2%,0.1%
657,28/02/2025,16:00,GBP,medium,Nationwide HPI (YoY)  (Feb),3.9%,3.4%,4.1%
658,28/02/2025,22:30,USD,high,Core PCE Price Index (YoY)  (Jan),2.6%,2.6%,2.9%
659,28/02/2025,22:30,USD,high,Core PCE Price Index (MoM)  (Jan),0.3%,0.3%,0.2%
660,28/02/2025,22:30,USD,medium,Goods Trade Balance  (Jan),-153.26B,-116.90B,-122.01B
661,28/02/2025,22:30,USD,medium,PCE Price index (YoY)  (Jan),2.5%,2.5%,2.6%
662,28/02/2025,22:30,USD,medium,PCE price index (MoM)  (Jan),0.3%,0.3%,0.3%
663,28/02/2025,22:30,USD,low,Personal Income (MoM)  (Jan),0.9%,0.4%,0.4%
664,28/02/2025,22:30,USD,medium,Personal Spending (MoM)  (Jan),-0.2%,0.2%,0.8%
665,28/02/2025,22:30,USD,low,Real Personal Consumption (MoM)  (Jan),-0.5%,,0.5%
666,28/02/2025,22:30,USD,medium,Retail Inventories Ex Auto  (Jan),0.4%,,-0.1%
667,28/02/2025,22:30,USD,low,Wholesale Inventories (MoM)  (Jan),0.7%,0.1%,-0.4%
668,28/02/2025,23:45,USD,high,Chicago PMI  (Feb),45.5,40.5,39.5
669,11/02/2025,All Day,JPY,,Japan - National Day,,,
670,17/02/2025,All Day,USD,,United States - Washington's Birthday,,,
671,24/02/2025,All Day,JPY,,Japan - Emperor's Birthday,,,
