id,date,time,currency,importance,event,actual,forecast,previous
726,31/10/2024,08:50,JPY,medium,Industrial Production (MoM)  (Sep),1.4%,0.9%,-3.3%
727,31/10/2024,08:50,JPY,low,Industrial Production forecast 1m ahead (MoM)  (Oct),8.3%,,2.0%
728,31/10/2024,08:50,JPY,low,Industrial Production forecast 2m ahead (MoM)  (Nov),-3.7%,,6.1%
729,31/10/2024,08:50,JPY,low,Large Retailers' Sales (MoM)  (Sep),-2.3%,,1.0%
730,31/10/2024,08:50,JPY,low,Large Scale Retail Sales YoY (YoY)  (Sep),2.0%,,5.0%
731,31/10/2024,08:50,JPY,low,Retail Sales (YoY)  (Sep),0.5%,2.1%,3.1%
732,31/10/2024,09:30,AUD,low,Building Approvals (YoY)  (Sep),18.10%,7.90%,24.90%
733,31/10/2024,09:30,AUD,medium,Building Approvals (MoM)  (Sep),4.4%,2.2%,-3.9%
734,31/10/2024,09:30,AUD,low,Export Price Index (QoQ)  (Q3),-4.3%,,-5.9%
735,31/10/2024,09:30,AUD,low,Housing Credit  (Sep),0.5%,,0.4%
736,31/10/2024,09:30,AUD,low,Import Price Index (QoQ)  (Q3),-1.4%,-0.2%,1.0%
737,31/10/2024,09:30,AUD,low,Private House Approvals  (Sep),2.2%,,0.5%
738,31/10/2024,09:30,AUD,low,Private Sector Credit (MoM)  (Sep),0.5%,0.5%,0.5%
739,31/10/2024,09:30,AUD,medium,Retail Sales (MoM)  (Sep),0.1%,0.3%,0.7%
740,31/10/2024,09:30,AUD,low,Retail Sales (QoQ)  (Q3),0.5%,,-0.4%
741,31/10/2024,10:35,GBP,low,BoE Breeden Speaks,,,
742,31/10/2024,11:30,JPY,medium,BoJ Monetary Policy Statement,,,
743,31/10/2024,12:00,JPY,medium,BoJ Outlook Report (YoY),,,
744,31/10/2024,12:00,JPY,high,BoJ Interest Rate Decision,0.25%,0.25%,0.25%
745,31/10/2024,14:00,JPY,low,Construction Orders (YoY)  (Sep),-21.3%,,8.7%
746,31/10/2024,14:00,JPY,low,Housing Starts (YoY)  (Sep),-0.6%,-4.2%,-5.1%
747,31/10/2024,15:30,JPY,medium,BoJ Press Conference,,,
748,31/10/2024,18:00,EUR,medium,ECB Economic Bulletin,,,
749,31/10/2024,19:00,GBP,low,BoE Breeden Speaks,,,
750,31/10/2024,19:00,EUR,medium,Core CPI (YoY)  (Oct),2.7%,2.6%,2.7%
751,31/10/2024,19:00,EUR,low,Core CPI (MoM)  (Oct),0.2%,,0.1%
752,31/10/2024,19:00,EUR,medium,CPI (MoM)  (Oct),0.3%,,-0.1%
753,31/10/2024,19:00,EUR,high,CPI (YoY)  (Oct),2.0%,1.9%,1.7%
754,31/10/2024,19:00,EUR,low,"CPI, n.s.a  (Oct)",127.03,,126.60
755,31/10/2024,19:00,EUR,low,HICP ex Energy & Food (YoY)  (Oct),2.7%,,2.7%
756,31/10/2024,19:00,EUR,low,HICP ex Energy and Food (MoM)  (Oct),0.2%,,0.0%
757,31/10/2024,19:00,EUR,medium,Unemployment Rate  (Sep),6.3%,6.4%,6.3%
758,31/10/2024,20:30,USD,low,Challenger Job Cuts (YoY),50.9%,,53.4%
759,31/10/2024,20:30,USD,low,Challenger Job Cuts  (Oct),55.597K,,72.821K
760,31/10/2024,21:30,USD,medium,Continuing Jobless Claims,"1,862K","1,890K","1,888K"
761,31/10/2024,21:30,USD,high,Core PCE Price Index (MoM)  (Sep),0.3%,0.3%,0.2%
762,31/10/2024,21:30,USD,high,Core PCE Price Index (YoY)  (Sep),2.7%,2.6%,2.7%
763,31/10/2024,21:30,USD,low,Employment Benefits (QoQ)  (Q3),0.80%,,1.00%
764,31/10/2024,21:30,USD,medium,Employment Cost Index (QoQ)  (Q3),0.8%,0.9%,0.9%
765,31/10/2024,21:30,USD,low,Employment Wages (QoQ)  (Q3),0.80%,,0.90%
766,31/10/2024,21:30,USD,high,Initial Jobless Claims,216K,229K,228K
767,31/10/2024,21:30,USD,low,Jobless Claims 4-Week Avg.,236.50K,,238.75K
768,31/10/2024,21:30,USD,medium,PCE Price index (YoY)  (Sep),2.1%,2.1%,2.3%
769,31/10/2024,21:30,USD,medium,PCE price index (MoM)  (Sep),0.2%,0.2%,0.1%
770,31/10/2024,21:30,USD,low,Personal Income (MoM)  (Sep),0.3%,0.3%,0.2%
771,31/10/2024,21:30,USD,medium,Personal Spending (MoM)  (Sep),0.5%,0.4%,0.3%
772,31/10/2024,21:30,USD,low,Real Personal Consumption (MoM)  (Sep),0.4%,,0.2%
773,31/10/2024,22:45,USD,high,Chicago PMI  (Oct),41.6,46.9,46.6
774,31/10/2024,23:30,USD,low,Natural Gas Storage,78B,79B,80B
775,14/10/2024,All Day,JPY,,Japan - National Sports Day,,,
